{
  "note_id": "note_2066",
  "specialty": " Orthopedic",
  "text": "EXAM: , Cervical, lumbosacral, thoracic spine flexion and extension.,HISTORY: , Back and neck pain.,CERVICAL SPINE,FINDINGS: ,AP, lateral with flexion and extension, and both oblique projections of the cervical spine demonstrate alignment and soft tissue structures to be unremarkable.",
  "checksum": "e60f9731cc89d8aea34f50507abfb1c5"
}