{
  "note_id": "note_4400",
  "specialty": " Consult - History and Phy.",
  "text": "HISTORY OF PRESENT ILLNESS:, This is the initial clinic visit for a 41-year-old worker who is seen for a foreign body to his left eye. He states that he was doing his normal job when he felt a foreign body sensation. He attempted to flush this at work, but has had persistent pain which has progressively worsened throughout the course of the day. He has no significant blurriness of vision or photophobia.",
  "checksum": "483c75d90386e7e757049966e97d77c1"
}