{
  "note_id": "note_402",
  "specialty": " Surgery",
  "text": "PROCEDURE:, Punch biopsy of right upper chest skin lesion.,ESTIMATED BLOOD LOSS:, Minimal.,FLUIDS: , Minimal.,COMPLICATIONS:, None.,PROCEDURE:, The area around the lesion was anesthetized after she gave consent for her procedure. Punch biopsy including some portion of lesion and normal tissue was performed. Hemostasis was completed with pressure holding. The biopsy site was approximated with non-dissolvable suture. The area was hemostatic. All counts were correct and there were no complications. The patient tolerated the procedure well. She will see us back in approximately five days.,",
  "checksum": "2445d5bae32e0cdeb207938903fb5101"
}