{
  "note_id": "note_2515",
  "specialty": " Obstetrics / Gynecology",
  "text": "GENERAL EVALUATION:,Fetal Cardiac Activity: Normal at 140 BPM,Fetal Position: Variable,Placenta: Posterior without evidence of placenta previa.,Uterus: Normal,Cervix:",
  "checksum": "a792a7e5ad074cf48c9a568520cc4668"
}