{
  "note_id": "note_1521",
  "specialty": " Radiology",
  "text": "EXAM: ,Three views of the right foot.,REASON FOR EXAM: , Right foot trauma.,FINDINGS: , Three views of the right foot were obtained. There are no comparison studies. There is no evidence of fractures or dislocations. No significant degenerative changes or obstructive osseous lesions were identified. There are no radiopaque foreign bodies.,IMPRESSION: , Negative right foot.",
  "checksum": "7be4f92edf744858627bebfbe2b7ae80"
}