{
  "note_id": "note_4213",
  "specialty": " Consult - History and Phy.",
  "text": "ALLOWED CONDITION: , Right shoulder sprain and right rotator cuff tear (partial).,CONTESTED CONDITION:, AC joint arthrosis right aggravation.,DISALLOWED CONDITION: ,",
  "checksum": "5ca42a348d2c1e3a40e49c87be27c3be"
}