{
  "note_id": "note_1688",
  "specialty": " Radiology",
  "text": "EXAM:, CT cervical spine (C-spine) for trauma.,FINDINGS:, CT examination of the cervical spine was performed without contrast. Coronal and sagittal reformats were obtained for better anatomical localization. Cervical vertebral body height, alignment and interspacing are maintained. There is no evidence of fractures or destructive osseous lesions. There are no significant degenerative endplate or facet changes. No significant osseous central canal or foraminal narrowing is present.,IMPRESSION: , Negative cervical spine.",
  "checksum": "ea34b5a1b0f73cf1854442585ad5409a"
}