{
  "note_id": "note_1965",
  "specialty": " Pain Management",
  "text": "POST PROCEDURE INSTRUCTIONS:, The patient has been asked to report to us any redness, swelling, inflammation, or fevers. The patient has been asked to restrict the use of the * extremity for the next 24 hours.",
  "checksum": "5a30fc1903997100be8a5389502edb11"
}