{
  "note_id": "note_2394",
  "specialty": " Ophthalmology",
  "text": "The effects of eye dilation drops will gradually decrease. It typically takes TWO to SIX HOURS for the effects to wear off. During this time, reading may be more difficult and sensitivity to light may increase. For a short time, wearing sunglasses may help.",
  "checksum": "5136076e78216f8ec36d5a24b8d1bf64"
}