{
  "note_id": "note_1726",
  "specialty": " Radiology",
  "text": "EXAM: , Chest PA & Lateral.,REASON FOR EXAM: , Shortness of breath, evaluate for pneumothorax versus left-sided effusion.,INTERPRETATION: ,There has been interval development of a moderate left-sided pneumothorax with near complete collapse of the left upper lobe. The lower lobe appears aerated. There is stable, diffuse, bilateral interstitial thickening with no definite acute air space consolidation. The heart and pulmonary vascularity are within normal limits. Left-sided port is seen with Groshong tip at the SVC/RA junction. No evidence for acute fracture, malalignment, or dislocation.,IMPRESSION:,1. Interval development of moderate left-sided pneumothorax with corresponding left lung atelectasis.,2. Rest of visualized exam nonacute/stable.,3. Left central line appropriately situated and stable.,4. Preliminary report was issued at time of dictation. Dr. X was called for results.",
  "checksum": "4fae6b1ca639c7e40ccd1c738aa5130e"
}