{
  "note_id": "note_1642",
  "specialty": " Radiology",
  "text": "There is normal and symmetrical filling of the caliceal system. Subsequent films demonstrate that the kidneys are of normal size and contour bilaterally. The caliceal system and ureters are in their usual position and show no signs of obstruction or intraluminal defects. The postvoid films demonstrate normal emptying of the collecting system, including the urinary bladder.,IMPRESSION:, Negative intravenous urogram.,",
  "checksum": "2162cd82cefaf563e84161ba402c45e1"
}