{
  "note_id": "note_2842",
  "specialty": " Neurology",
  "text": "FINDINGS:,There is a large intrasellar mass lesion producing diffuse expansion of the sella turcica. This mass lesions measures approximately 16 x 18 x 18mm (craniocaudal x AP x mediolateral) in size.",
  "checksum": "fe8fb8728555d4265cb8842669798f29"
}