{
  "note_id": "note_1756",
  "specialty": " Radiology",
  "text": "2-D ECHOCARDIOGRAM,Multiple views of the heart and great vessels reveal normal intracardiac and great vessel relationships. Cardiac function is normal. There is no significant chamber enlargement or hypertrophy. There is no pericardial effusion or vegetations seen. Doppler interrogation, including color flow imaging, reveals systemic venous return to the right atrium with normal tricuspid inflow. Pulmonary outflow is normal at the valve. Pulmonary venous return is to the left atrium. The interatrial septum is intact. Mitral inflow and ascending aorta flow are normal. The aortic valve is trileaflet. The coronary arteries appear to be normal in their origins. The aortic arch is left-sided and patent with normal descending aorta pulsatility.",
  "checksum": "c020fe8579b1be29dc1cb13ced835927"
}