{
  "note_id": "note_1686",
  "specialty": " Radiology",
  "text": "TECHNIQUE: , Sequential axial CT images were obtained through the facial bones without contrast. Additional high resolution coronal reconstructed images were also obtained for better visualization of the osseous structures.,FINDINGS:, The osseous structures within the face are intact with no evidence of fracture or dislocation. The visualized paranasal sinuses and mastoid air cells are clear. The orbits and extra-ocular muscles are within normal limits. The soft tissues are unremarkable. ,IMPRESSION: , No acute abnormalities.",
  "checksum": "373f31435b71e47fdc30a13909d796ab"
}