{
  "note_id": "note_1345",
  "specialty": " SOAP / Chart / Progress Notes",
  "text": "She is stable at this time and does not require any intervention at today's visit. I have asked her to return in six months' for a followup dilated examination, but would be happy to see her sooner should you or she notice any changes in her vision.",
  "checksum": "986ddb123aad457cdd893bf0ef4285ff"
}